{
  "id": "tecnico-em-agente-comunitario-de-saude",
  "indice": 1,
  "denominacao": "Técnico em Agente Comunitário de Saúde",
  "denominacao_normalizada": "tecnico em agente comunitario de saude",
  "eixo_tecnologico": "Ambiente e Saúde",
  "area_tecnologica": "Gestão e Promoção da Saúde e Bem-Estar",
  "carga_horaria_minima_horas": 1200,
  "descricao_carga_horaria_minima": "O curso dura, em média, 1 ano e meio.\n\nO curso, na modalidade presencial, poderá prever até 20% da sua carga horária total em atividades não presenciais.\n\nO curso não poderá ser realizado na modalidade EaD, conforme disposto na Lei nº 11.350, de 5 de outubro de 2006, e suas alterações.\n\nA instituição, ofertante do curso, poderá desenvolver a carga horária em regime de alternância, com períodos de estudos na escola e outros períodos no campo/local de trabalho.\n\nAlém da carga horária mínima prevista, o curso poderá ter estágio curricular supervisionado obrigatório, conforme legislações/normativas específicas, ou a critério do projeto pedagógico da instituição ofertante do curso.",
  "perfil_profissional": "O Técnico em Agente Comunitário de Saúde será habilitado para:\n\nOrientar e acompanhar, sob a supervisão de profissional de nível superior, indivíduos, suas famílias e a população em seu território, levando em conta a interação com o processo saúde-doença no território.\nIdentificar e atuar nos múltiplos determinantes e condicionantes do processo saúde e doença, para a promoção da saúde e redução de riscos à saúde individual e da coletividade.\nRealizar o mapeamento e o cadastramento de dados sociais, demográficos e de saúde, para contribuir com a produção de informações e a construção de revisão contínua do plano de ação em saúde para os territórios.\nDesenvolver suas atividades norteadas pelas diretrizes, pelos princípios e estrutura organizacional do SUS, bem como a partir dos referenciais éticos e políticos da Educação Popular em Saúde.\nPromover a comunicação entre equipe multidisciplinar (Equipe de Saúde da Família), unidade de saúde, autoridades e comunidade.\nPromover a mobilização comunitária, ações educativas e incentivar as atividades comunitárias, promovendo a integração entre a equipe de saúde e a comunidade.\nPromover ações nas áreas de vigilância em saúde e ambiental.\nAcompanhar e orientar, por meio de visita domiciliar estabelecidas no planejamento das equipes, as pessoas em situação de vulnerabilidade social e portadoras de doenças crônicas e agravos que necessitam de maior número de visitas, estimulando o autocuidado e a prevenção da exposição a fatores de riscos, realizando procedimentos específicos nos casos indicados pela equipe ou encaminhando quando necessário para a unidade de saúde de referência.\n\nPara a atuação como Técnico em Agente Comunitário de Saúde, são fundamentais:\n\nConhecimentos das políticas públicas de saúde e compreensão de sua atuação profissional frente às diretrizes, princípios e estrutura organizacional do Sistema Único de Saúde (SUS).\nConhecimentos referentes ao âmbito da promoção da saúde, prevenção de agravos frequentes na atenção primária, dirigidas a indivíduos, famílias, comunidades e população.\nConhecimentos referentes à educação popular em saúde, à promoção da saúde dos indivíduos nos diferentes ciclos de vida, suas famílias e sua comunidade e dos atributos derivados da atenção primária da saúde.\nConhecimentos relativos ao âmbito da promoção, da prevenção e do monitoramento das situações de risco no âmbito da Vigilância em Saúde.\nConhecimentos referentes ao trabalho em equipe e interdisciplinar, a comunicação em saúde, ao registro e informação em saúde.\nConhecimentos e saberes relacionados aos princípios das técnicas aplicadas na área, sempre pautados numa postura humana e ética.\nAtualização e aperfeiçoamento profissional por meio da Educação Continuada.\nConhecimentos e saberes relacionados à Política de Inclusão e ao Atendimento Educacional Especializado.",
  "pre_requisitos_ingresso": "Para ingresso no Curso Técnico Subsequente, o estudante deverá ter concluído o Ensino Médio.\nPara ingresso no Curso Técnico Concomitante, o estudante deverá estar cursando o Ensino Médio.\nPara ingresso no Curso Técnico Integrado ao Ensino Médio, o estudante deverá ter concluído o Ensino Fundamental.\nPara ingresso no Curso Técnico Integrado à Educação de Jovens e Adultos, o estudante deverá ter concluído o Ensino Fundamental.",
  "itinerarios_formativos": "Sugestões de qualificação profissional com certificações intermediárias, no curso técnico, considerando ocupações previstas na CBO:\n\nAgente Comunitário de Saúde\n\nSugestões de formação continuada em cursos de especialização técnica (pós-técnico):\n\nEspecialização Técnica em Epidemiologia Estatística em Saúde\nEspecialização Técnica em Políticas Públicas de Saúde da Família com Ênfase nas Linhas do Cuidado\nEspecialização Técnica em Saúde da Família\nEspecialização Técnica em Saúde do Idoso\nEspecialização Técnica em Saúde Materno/Infantil\nEspecialização Técnica em Saúde Mental\nEspecialização Técnica em Vigilância à Saúde do Trabalhador\nEspecialização Técnica em Vigilância em Saúde\n\nSugestões de verticalização para cursos de graduação (Curso Superior de Tecnologia, bacharelado e licenciatura):\n\nBacharelado em Enfermagem\nBacharelado em Medicina\nBacharelado em Nutrição\nBacharelado em Psicologia\nBacharelado em Serviço Social",
  "campo_atuacao": "Locais e ambientes de trabalho:\n\nSistema Único de Saúde (SUS)",
  "ocupacoes_cbo": "3222-55 - Técnico em Agente Comunitário de Saúde",
  "codigos_cbo": [
    "3222-55"
  ],
  "infraestrutura_minima": "Biblioteca com acervo físico ou virtual específico e atualizado\nLaboratório multidisciplinar\nLaboratório de informática com acesso à internet\nSalas para práticas pedagógicas participativas e ativas",
  "legislacao_profissional": "Lei nº 11.350, de 5 de outubro de 2006\nLei nº 13.595, de 5 de janeiro de 2018\nDecreto nº 3.189, de 4 de outubro de 1999\nPortaria MS nº 2.436, de 21 de setembro de 2017"
}
