{
  "id": "tecnico-em-equipamentos-biomedicos",
  "indice": 7,
  "denominacao": "Técnico em Equipamentos Biomédicos",
  "denominacao_normalizada": "tecnico em equipamentos biomedicos",
  "eixo_tecnologico": "Ambiente e Saúde",
  "area_tecnologica": "Gestão e Promoção da Saúde e Bem-Estar",
  "carga_horaria_minima_horas": 1200,
  "descricao_carga_horaria_minima": "O curso dura, em média, 1 ano e meio.\n\nO curso, na modalidade presencial, poderá prever até 20% da sua carga horária total em atividades não presenciais.\n\nO curso poderá ser realizado na modalidade EaD com, no mínimo, 50% da carga horária em atividades presenciais, nos termos das normas específicas definidas em cada sistema de ensino.\n\nAlém da carga horária mínima prevista, o curso poderá ter estágio curricular supervisionado obrigatório, a critério da instituição ofertante.\n\nCaso o curso seja ofertado na modalidade EaD, a carga horária de estágio deverá ser cumprida de forma presencial.",
  "perfil_profissional": "O Técnico em Equipamentos Biomédicos será habilitado para:\n\nAdministrar e comercializar equipamentos biomédicos.\nAnalisar e executar os testes de calibração e aferição dos equipamentos médico-hospitalares.\nAnalisar, tecnicamente, os certificados de calibração e aferição.\nAuxiliar na definição de medidas de controle de segurança e qualidade no ambiente hospitalar referente ao uso de equipamentos médico-hospitalares- odontológicos.\nAuxiliar na elaboração da especificação técnica para aquisição de novos equipamentos.\nAuxiliar na elaboração do planejamento da gestão da manutenção de equipamentos médico-hospitalares-odontológicos.\nCoordenar o armazenamento e uso adequado de equipamentos.\nExecutar as ações planejadas de manutenção preventiva, preditiva e corretiva, instalação, montagem, medições e testes de equipamentos médicos.\nExecutar instalação e manutenção de equipamentos médico-hospitalares- odontológicos.\nParticipar e realizar treinamento operacional e de controle de segurança e qualidade de equipamentos médicos para equipe médico-assistencial.\nPlanejar e executar instalação, montagem, medições e testes de equipamentos biomédicos.\nPrestar assistência técnica no estudo e desenvolvimento de projetos e pesquisas de tecnologias de equipamentos médico-hospitalares-odontológicos.\nRealizar coleta de campo de dados que auxiliam o planejamento e a gestão da manutenção de equipamentos médicos e da infraestrutura das instalações hospitalares.\nRealizar e registrar os procedimentos de manutenção preventiva, preditiva e corretiva de equipamentos e instrumentos médico-hospitalares-odontológicos.\nRegistrar os procedimentos das ações planejadas de manutenção preventiva, preditiva e corretiva de equipamentos e instrumentos médico-hospitalares-odontológicos.\n\nPara a atuação como Técnico em Equipamentos Biomédicos, são fundamentais:\n\nConhecimentos das políticas públicas de saúde e compreensão de sua atuação profissional frente às diretrizes, princípios e estrutura organizacional do Sistema Único de Saúde (SUS).\nConhecimentos e saberes relacionados aos princípios das técnicas aplicadas na área.\nResolução de situações-problema, comunicação, trabalho em equipe e interdisciplinar, tecnologias da informação e da comunicação, gestão de conflitos e ética profissional.\nOrganização e responsabilidade.\nAtualização e aperfeiçoamento profissional por meio da educação continuada.",
  "pre_requisitos_ingresso": "Para ingresso no Curso Técnico Subsequente, o estudante deverá ter concluído o Ensino Médio.\nPara ingresso no Curso Técnico Concomitante, o estudante deverá estar cursando o Ensino Médio.\nPara ingresso no Curso Técnico Integrado ao Ensino Médio, o estudante deverá ter concluído o Ensino Fundamental.\nPara ingresso no Curso Técnico Integrado à Educação de Jovens e Adultos, o estudante deverá ter concluído o Ensino Fundamental.",
  "itinerarios_formativos": "Sugestões de qualificação profissional com certificações intermediárias, no curso técnico, considerando ocupações previstas na CBO:\n\nEletricista Industrial\n\nSugestões de formação continuada em cursos de especialização técnica (pós-técnico):\n\nEspecialização Técnica em Metrologia\n\nSugestões de verticalização para cursos de graduação (Curso Superior de Tecnologia, Bacharelado e Licenciatura):\n\nCurso Superior de Tecnologia em Sistemas Biomédicos\nCurso Superior de Tecnologia em Radiologia\nBacharelado em Engenharia Biomédica\nBacharelado em Engenharia",
  "campo_atuacao": "Locais e ambientes de trabalho:\n\nClínicas\nEmpresas Fabricantes ou Revendedoras de Equipamentos Médico-Hospitalares\nEmpresas Prestadoras de Serviços de Assistência Técnica\nHospitais\nInstituições de Pesquisa\nLaboratórios Clínicos\nUnidades de Saúde",
  "ocupacoes_cbo": "9153-05 - Técnico em Manutenção de Equipamentos e Instrumentos Médico-Hospitalares",
  "codigos_cbo": [
    "9153-05"
  ],
  "infraestrutura_minima": "Biblioteca com acervo físico ou virtual específico e atualizado\nLaboratório de elétrica, eletrônica, mecânica, calor, fluídos e eletropneumática, sistemas digitais\nLaboratório de informática com programas específicos ao curso e acesso à internet\nLaboratório de equipamentos biomédicos",
  "legislacao_profissional": "Lei nº 5.524, de 5 de novembro de 1968\nDecreto nº 90.922, de 6 de fevereiro de 1985\nDecreto nº 4.560, de 30 de dezembro de 2002\nResolução CFT nº 85, de 28 de outubro de 2019"
}
