{
  "id": "tecnico-em-hospedagem",
  "indice": 185,
  "denominacao": "Técnico em Hospedagem",
  "denominacao_normalizada": "tecnico em hospedagem",
  "eixo_tecnologico": "Turismo, Hospitalidade e Lazer",
  "area_tecnologica": "Acolhimento e Hospedagem",
  "carga_horaria_minima_horas": 800,
  "descricao_carga_horaria_minima": "O curso dura, em média, 1 ano.\n\nO curso ofertado, na modalidade presencial, poderá prever até 20% da sua carga horária total em atividades não presenciais.\n\nO curso poderá ser realizado na modalidade EaD com, no mínimo, 20% da carga horária em atividades presenciais, nos termos das normas específicas definidas em cada sistema de ensino.\n\nA instituição, ofertante do curso, poderá desenvolver a carga horária em regime de alternância, com períodos de estudos na escola e outros períodos no campo/local de trabalho.\n\nAlém da carga horária mínima prevista, o curso poderá ter estágio curricular supervisionado obrigatório, a critério da instituição ofertante.\n\nCaso o curso seja ofertado na modalidade EaD, a carga horária de estágio deverá ser cumprida de forma presencial.",
  "perfil_profissional": "O Técnico em Hospedagem será habilitado para:\n\nRealizar atividades de recepção, reserva, governança, mensageria, mordomia e conciergerie em meios de hospedagem.\nPrestar serviços de atendimento e suporte aos hóspedes.\nDivulgar os serviços de hospedagem e produtos turísticos.\nSupervisionar a manutenção de equipamentos e estrutura física.\nAcompanhar e orientar procedimentos de higienização, controle e arrumação das unidades habitacionais e dos espaços do estabelecimento.\nAuxiliar na operacionalização de eventos, serviços, alimentos e bebidas, articulando às necessidades dos hóspedes, fornecedores e clientes.\n\nPara atuação como Técnico em Hospedagem, são fundamentais:\n\nConhecimentos multidisciplinares sobre aspectos geográficos, históricos e turísticos da região, bem como conhecimentos técnicos sobre hospitalidade, classificação, estrutura, normas, procedimentos dos meios de hospedagem e sistemas operacionais.\nComunicação clara e cordial, respeito à diversidade, atenção à sustentabilidade, trabalho colaborativo, proatividade e flexibilidade para a solução de problemas e conflitos.",
  "pre_requisitos_ingresso": "Para ingresso no Curso Técnico Subsequente, o estudante deverá ter concluído o Ensino Médio.\nPara ingresso no Curso Técnico Concomitante, o estudante deverá estar cursando o Ensino Médio.\nPara ingresso no Curso Técnico Integrado ao Ensino Médio, o estudante deverá ter concluído o Ensino Fundamental.\nPara ingresso no Curso Técnico Integrado à Educação de Jovens e Adultos, o estudante deverá ter concluído o Ensino Fundamental.",
  "itinerarios_formativos": "Sugestões de qualificação profissional com certificações intermediárias, no curso técnico, considerando ocupações previstas na CBO:\n\nRecepcionista em Meios de Hospedagem\nCamareira em Meios de Hospedagem\n\nSugestões de formação continuada em cursos de especialização técnica (pós-técnico):\n\nEspecialização Técnica em Hospedagem em Ambientes Hospitalares\n\nSugestões de verticalização para cursos de graduação (Curso Superior de Tecnologia, Bacharelado e Licenciatura):\n\nCurso Superior de Tecnologia em Hotelaria\nCurso Superior de Tecnologia em Gestão do Turismo\nBacharelado em Hotelaria\nBacharelado em Turismo",
  "campo_atuacao": "Locais e ambientes de trabalho:\n\nHotéis\nResorts\nPousadas\nMotéis\nHostels\nCruzeiros e embarcações turísticas\nFlats\nCondomínios residenciais\nEmpreendimentos de hospedagem compartilhada e acampamentos\nEstabelecimentos de saúde\nParques temáticos\nPlataformas de petróleo\nTrens\nShoppings",
  "ocupacoes_cbo": "4221-20 - Recepcionista de Hotel\n5131-15 - Governanta de Hotelaria\n5131-10 - Mordomo de Hotelaria",
  "codigos_cbo": [
    "4221-20",
    "5131-15",
    "5131-10"
  ],
  "infraestrutura_minima": "Biblioteca com acervo físico ou virtual específico e atualizado\nLabotarório de informática com programas específicos\nLaboratório de recepção com programas específicos relacionados aos sistemas operacionais em meios de hospedagem\nLaboratório de governança",
  "legislacao_profissional": "Profissão não regulamentada."
}
