{
  "id": "tecnico-em-artesanato",
  "indice": 135,
  "denominacao": "Técnico em Artesanato",
  "denominacao_normalizada": "tecnico em artesanato",
  "eixo_tecnologico": "Produção Cultural e Design",
  "area_tecnologica": "Manifestações Artísticas",
  "carga_horaria_minima_horas": 800,
  "descricao_carga_horaria_minima": "O curso dura, em média, 1 ano.\n\nO curso, na modalidade presencial, poderá prever até 20% da sua carga horária total em atividades não presenciais.\n\nO curso poderá ser realizado na modalidade EaD com, no mínimo, 20% de sua carga horária em atividades presenciais, nos termos das normas específicas definidas em cada sistema de ensino.\n\nA instituição, ofertante do curso, poderá desenvolver a carga horária em regime de alternância, com períodos de estudos na escola e outros períodos no campo de atuação/local de trabalho.\n\nAlém da carga horária mínima prevista, o curso poderá ter estágio curricular supervisionado obrigatório, a critério da instituição ofertante.\n\nCaso o curso seja ofertado na modalidade EaD, a carga horária de estágio deverá ser cumprida de forma presencial.",
  "perfil_profissional": "O Técnico em Artesanato será habilitado para:\n\nCriar e produzir trabalhos artesanais de peças decorativas e utilitárias, com materiais diversos e recursos naturais.\nExplorar a riqueza e o repertório cultural existentes.\nComercializar produtos artesanais no varejo e no atacado.\nGerenciar negócios na perspectiva do associativismo e do cooperativismo.\nSelecionar técnicas de tratamento, preparação e transformação de matérias- primas.\nRespeitar e valorizar o traço e a diversidade cultural da região.\n\nPara atuação como Técnico em Artesanato, são fundamentais:\n\nConhecimentos interdisciplinares relacionados aos processos de criação, envolvendo pesquisa, idealização, planejamento, execução técnica, fruição e recepção estética.\nCompetências comunicativas e empreendedoras voltadas à proposição de projetos, ao coletivo, à gestão, à solução de problemas e à resiliência, entre outras competências socioemocionais.",
  "pre_requisitos_ingresso": "Para ingresso no Curso Técnico Subsequente, o estudante deverá ter concluído o Ensino Médio.\nPara ingresso no Curso Técnico Concomitante, o estudante deverá estar cursando o Ensino Médio.\nPara ingresso no Curso Técnico Integrado ao Ensino Médio, o estudante deverá ter concluído o Ensino Fundamental.\nPara ingresso no Curso Técnico Integrado à Educação de Jovens e Adultos, o estudante deverá ter concluído o Ensino Fundamental.",
  "itinerarios_formativos": "Sugestões de qualificação profissional com certificações intermediárias, no curso técnico, considerando ocupações previstas na CBO:\n\nNão identificadas\n\nSugestões de formação continuada em cursos de especialização técnica (pós-técnico):\n\nEspecialização Técnica em Empreendedorismo Social\n\nSugestões de verticalização para cursos de graduação (Curso Superior de Tecnologia, Bacharelado, Licenciatura):\n\nCurso Superior de Tecnologia em Produção de Vestuário\nCurso Superior de Tecnologia em Produção Gráfica\nCurso Superior de Tecnologia em Design de Moda\nCurso Superior de Tecnologia em Design de Produto\nCurso Superior de Tecnologia em Produção Cultural\nCurso Superior de Tecnologia em Design Gráfico",
  "campo_atuacao": "Locais e ambientes de trabalho:\n\nProfissional Autônomo\nCooperativas de Artesanato\nExposições e Feiras de Cultura\nLojas e Produtoras de Artesanato\nInstituições Culturais\nMuseus e Galerias\nCentros Culturais",
  "ocupacoes_cbo": "7521-05 - Artesão Modelador (vidros)\n7521-05 - Gambista (artesão de vidros)\n7521-05 - Mestre Vidreiro\n7521-05 - Miniaturista (artesão de vidros)\n7911-05 - Artesão Bordador\n7911-10 - Artesão Ceramista\n7911-15 - Artesão com Material Reciclável\n7911-20 - Artesão Confeccionador de Biojóias e Ecojóias\n7911-25 - Artesão do Couro\n7911-30 - Artesão Escultor\n7911-35 - Artesão Moveleiro (exceto reciclado)\n7911-40 - Artesão Tecelão\n7911-45 - Artesão Trançador\n7911-50 - Artesão Crocheteiro\n7911-55 - Artesão Tricoteiro\n7911-60 - Artesão Rendeiro",
  "codigos_cbo": [
    "7521-05",
    "7911-05",
    "7911-10",
    "7911-15",
    "7911-20",
    "7911-25",
    "7911-30",
    "7911-35",
    "7911-40",
    "7911-45",
    "7911-50",
    "7911-55",
    "7911-60"
  ],
  "infraestrutura_minima": "Biblioteca com acervo físico ou virtual específico e atualizado\nAteliê de artesanato",
  "legislacao_profissional": "Profissão não regulamentada."
}
