{
  "id": "tecnico-em-eletromecanica",
  "indice": 34,
  "denominacao": "Técnico em Eletromecânica",
  "denominacao_normalizada": "tecnico em eletromecanica",
  "eixo_tecnologico": "Controle e Processos Industriais",
  "area_tecnologica": "Eletrônica e Automação",
  "carga_horaria_minima_horas": 1200,
  "descricao_carga_horaria_minima": "O curso dura, em média, 1 ano e meio.\n\nO curso ofertado, na modalidade presencial, poderá prever até 20% da sua carga horária total em atividades não presenciais.\n\nO curso poderá ser realizado na modalidade EaD com, no mínimo, 20% de sua carga horária em atividades presenciais, nos termos das normas específicas definidas em cada sistema de ensino.\n\nA instituição, ofertante do curso, poderá desenvolver a carga horária em regime de alternância, com períodos de estudos na escola e outros períodos no campo/local de trabalho.\n\nAlém da carga horária mínima prevista, o curso poderá ter estágio curricular supervisionado obrigatório, a critério da instituição ofertante.\n\nCaso o curso seja ofertado na modalidade EaD, a carga horária de estágio deverá ser cumprida de forma presencial.",
  "perfil_profissional": "O Técnico em Eletromecânica será habilitado para:\n\nPlanejar, controlar e executar a instalação, a manutenção e a entrega técnica de máquinas e equipamentos eletromecânicos industriais, considerando as normas, os padrões e os requisitos técnicos de qualidade, saúde e segurança e de meio ambiente.\nElaborar projetos de produtos relacionados a máquinas e equipamentos eletromecânicos especificando materiais para construção mecânica e elétrica por meio de técnicas de usinagem e soldagem.\nRealizar inspeção visual, dimensional e testes em sistemas, instrumentos, equipamentos eletromecânicos, pneumáticos e hidráulicos de máquinas.\nReconhecer tecnologias inovadoras presentes no segmento visando a atender às transformações digitais na sociedade.\n\nPara atuação como Técnico em Eletromecânica, são fundamentais:\n\nConhecimentos e saberes relacionados aos processos de planejamento, produção e manutenção de equipamentos eletromecânicos de modo a assegurar a saúde e a segurança dos trabalhadores e dos usuários.\nConhecimentos e saberes relacionados à sustentabilidade do processo produtivo, às técnicas e aos processos de produção, às normas técnicas, à liderança de equipes, à solução de problemas técnicos e trabalhistas e à gestão de conflitos.",
  "pre_requisitos_ingresso": "Para ingresso no Curso Técnico Subsequente, o estudante deverá ter concluído o Ensino Médio.\nPara ingresso no Curso Técnico Concomitante, o estudante deverá estar cursando o Ensino Médio.\nPara ingresso no Curso Técnico Integrado ao Ensino Médio, o estudante deverá ter concluído o Ensino Fundamental.\nPara ingresso no Curso Técnico Integrado à Educação de Jovens e Adultos, o estudante deverá ter concluído o Ensino Fundamental.",
  "itinerarios_formativos": "Sugestões de qualificação profissional com certificações intermediárias, no curso técnico, considerando ocupações previstas na CBO:\n\nEletricista Predial de Baixa Tensão\nEletromecânico de Manutenção de Elevadores\nEletromecânico de Manutenção de Escadas Rolantes\nEletromecânico de Manutenção de Portas Automáticas\nMecânico de Manutenção de Máquinas\nMecânico de Fabricação\nOperador Eletromecânico\nInstalador de Sistemas Fotovoltaicos\n\nSugestões de formação continuada em cursos de especialização técnica (pós-técnico):\n\nEspecialização Técnica em Programação e Operação de Máquinas CNC\nEspecialização Técnica em Usinagem\nEspecialização Técnica em Desenho Assistido por Computador (CAD)\nEspecialização Técnica em Manufatura Assistida por Computador (CAM)\nEspecialização Técnica em Eficiência Energética em Edificações\nEspecialização Técnica em Eficiência Energética Industrial\nEspecialização Técnica em Energia Solar Fotovoltaica\nEspecialização Técnica em Energia Eólica\nEspecialização Técnica em Implantação e Comissionamento de Parques Eólicos\nEspecialização Técnica em Instalação Elétrica Predial de Baixa Tensão\nEspecialização Técnica em Biocombustíveis\nEspecialização Técnica em Biogás e Biometano\nEspecialização Técnica em Aproveitamento Energético de Biogás\n\nSugestões de verticalização para cursos de graduação (Curso Superior de Tecnologia, Bacharelado e Licenciatura):\n\nCurso Superior de Tecnologia em Automação Industrial\nCurso Superior de Tecnologia em Eletrônica Industrial\nCurso Superior de Tecnologia em Eletrotécnica Industrial\nCurso Superior de Tecnologia em Manutenção Industrial\nCurso Superior de Tecnologia em Mecatrônica Industrial\nCurso Superior de Tecnologia em Fabricação Mecânica\nCurso Superior de Tecnologia em Processos Metalúrgicos\nBacharelado em Engenharia Eletrônica\nBacharelado em Engenharia Elétrica\nBacharelado em Engenharia de Automação e Controle\nBacharelado em Engenharia Mecatrônica\nBacharelado em Engenharia Mecânica\nBacharelado em Engenharia de Produção\nBacharelado em Engenharia Metalúrgica",
  "campo_atuacao": "Locais e ambientes de trabalho:\n\nIndústrias com linhas de produção automatizadas, aeroespaciais, automobilística, metalmecânica e plástico\nEmpresas de manutenção e reparos eletromecânicos, que atuam na instalação, manutenção, comercialização e utilização de equipamentos e sistemas eletromecânicos",
  "ocupacoes_cbo": "3003-05 - Auxiliar Técnico de Instalações Eletromecânicas",
  "codigos_cbo": [
    "3003-05"
  ],
  "infraestrutura_minima": "Biblioteca com acervo físico ou virtual específico e atualizado\nLabotarório de informática com programas específicos\nLaboratório de eletricidade e eletrônica\nLaboratório de acionamentos elétricos\nLaboratório de máquinas elétricas\nLaboratório de instalações elétricas\nLaboratório de desenho técnico\nLaboratório de metrologia dimensional\nLaboratório de eletropneumática e eletro-hidráulica\nLaboratório de máquinas operatrizes (convencional e CNC/CAM)\nLaboratório de manutenção mecânica",
  "legislacao_profissional": "Lei nº 5.524, de 5 de novembro de 1968\nDecreto nº 90.922, de 6 de fevereiro de 1985\nDecreto nº 4.560, de 30 de dezembro de 2002\nResolução CFT nº 85, de 28 de outubro de 2019\nLei nº 13.639, de 26 de março de 2018\nResolução CFT nº 100, de 27 de abril de 2020\nResolução CFT nº 68, de 24 de maio de 2019\nResolução CFT nº 81, de 26 de outubro de 2019\nResolução CFT nº 121, de 14 de dezembro de 2020"
}
