{
  "id": "tecnico-em-paisagismo",
  "indice": 144,
  "denominacao": "Técnico em Paisagismo",
  "denominacao_normalizada": "tecnico em paisagismo",
  "eixo_tecnologico": "Produção Cultural e Design",
  "area_tecnologica": "Manifestações Artísticas",
  "carga_horaria_minima_horas": 1000,
  "descricao_carga_horaria_minima": "O curso dura, em média, 1 ano.\n\nO curso, na modalidade presencial, poderá prever até 20% da sua carga horária total em atividades não presenciais.\n\nO curso poderá ser realizado na modalidade EaD com, no mínimo, 20% de sua carga horária em atividades presenciais, nos termos das normas específicas definidas em cada sistema de ensino.\n\nA instituição, ofertante do curso, poderá desenvolver a carga horária em regime de alternância, com períodos de estudos na escola e outros períodos no campo de atuação/local de trabalho.\n\nAlém da carga horária mínima prevista, o curso poderá ter estágio curricular supervisionado obrigatório, a critério da instituição ofertante.\n\nCaso o curso seja ofertado na modalidade EaD, a carga horária de estágio deverá ser cumprida de forma presencial.",
  "perfil_profissional": "O Técnico em Paisagismo será habilitado para:\n\nElaborar e executar projetos de paisagismo.\nRealizar diagnóstico do local e apresentar propostas de intervenção, acompanhando o gerenciamento do projeto.\nOrganizar espaços de acordo com o projeto, respeitando o meio ambiente.\nAtuar na preservação e conservação de jardins de interesse patrimonial.\nElaborar representações gráficas bi e tridimensionais.\nEsboçar e definir especificidades e características de espaços, dos objetos e seus elementos.\nElaborar planos de trabalho que garantam a fidelidade na execução do projeto.\nProduzir plantas ornamentais.\nSupervisionar a manutenção de espaços de paisagismo, de jardins e de plantas ornamentais.\nGerenciar empreendimento paisagístico.\nZelar pela estética do produto (características plásticas, botânicas e ambientais), bem como zelar pelo respeito e preservação ambiental.\n\nPara atuação como Técnico em Paisagismo, são fundamentais:\n\nConhecimentos interdisciplinares relacionados aos processos de criação, envolvendo pesquisa, idealização, planejamento, execução técnica, fruição e recepção estética.\nCompetências comunicativas e empreendedoras voltadas à proposição de projetos, ao coletivo, à gestão, à solução de problemas e à resiliência, entre outras competências socioemocionais.",
  "pre_requisitos_ingresso": "Para ingresso no Curso Técnico Subsequente, o estudante deverá ter concluído o Ensino Médio.\nPara ingresso no Curso Técnico Concomitante, o estudante deverá estar cursando o Ensino Médio.\nPara ingresso no Curso Técnico Integrado ao Ensino Médio, o estudante deverá ter concluído o Ensino Fundamental.\nPara ingresso no Curso Técnico Integrado à Educação de Jovens e Adultos, o estudante deverá ter concluído o Ensino Fundamental.",
  "itinerarios_formativos": "Sugestões de qualificação profissional com certificações intermediárias, no curso técnico, considerando ocupações previstas na CBO:\n\nAuxiliar Geral de Conservação de Vias Permanentes (exceto trilhos)\nEditor de Maquetes Eletrônicas\nCadista para a Construção Civil\nAssistente de Jardinagem\n\nSugestões de formação continuada em cursos de especialização técnica (pós-técnico):\n\nEspecialização Técnica em Medições Topográficas\nEspecialização Técnica em Projetista de Maquetes Eletrônicas\nEspecialização Técnica em Vendas e Comercialização Vegetal\nEspecialização Técnica em Produção de Plantas Aromáticas e Medicinais\n\nSugestões de verticalização para cursos de graduação (Curso Superior de Tecnologia, Bacharelado e Licenciatura):\n\nCurso Superior de Tecnologia em Gestão Ambiental\nCurso Superior de Tecnologia em Design de Interiores\nBacharelado em Agronomia\nBacharelado em Arquitetura e Urbanismo\nBacharelado em Ciências Biológicas\nBacharelado em Engenharia Florestal",
  "campo_atuacao": "Locais e ambientes de trabalho:\n\nEscritórios de Design\nEscritórios de Projetos de Arquitetura e de Paisagismo\nEmpresas de Jardinagem\nProdução e Comercialização de Plantas Ornamentais\nConstrutoras, Imobiliárias e Órgãos Públicos\nProfissional Autônomo e Prestador de Serviços para elaboração e execução de projetos de paisagismo, bem como realização de diagnóstico e gerenciamento de projetos\nEmpreendimento Próprio\nInstituições Culturais e Museológicas na conservação e preservação de projetos paisagísticos de natureza patrimonial",
  "ocupacoes_cbo": "Ocupação ainda não classificada",
  "codigos_cbo": [],
  "infraestrutura_minima": "Biblioteca com acervo físico ou virtual específico e atualizado\nLaboratório de informática com programas específicos\nLaboratório jardim pedagógico\nLaboratório de desenho",
  "legislacao_profissional": "Lei nº 5.524, de 5 de novembro de 1968\nDecreto nº 90.922, de 6 de fevereiro de 1985"
}
