{
  "id": "tecnico-em-transito",
  "indice": 106,
  "denominacao": "Técnico em Trânsito",
  "denominacao_normalizada": "tecnico em transito",
  "eixo_tecnologico": "Infraestrutura",
  "area_tecnologica": "Operações de Transporte",
  "carga_horaria_minima_horas": 1000,
  "descricao_carga_horaria_minima": "O curso dura, em média, 1 ano e meio\n\nO curso, na modalidade presencial, poderá prever até 20% da sua carga horária total em atividades não presenciais.\n\nO curso poderá ser realizado na modalidade EaD com, pelo menos, 20% de sua carga horária em atividades presenciais, nos termos das normas específicas definidas em cada sistema de ensino.\n\nA instituição poderá desenvolver o curso em regime de alternância com períodos de estudo na escola e no campo de atuação/local de trabalho.\n\nAlém da carga horária mínima prevista, o curso poderá ter estágio curricular supervisionado obrigatório, a critério da instituição ofertante.\n\nCaso o curso seja ofertado na modalidade EaD, a carga horária de estágio será cumprida de forma presencial.",
  "perfil_profissional": "O Técnico em Trânsito será habilitado para:\n\nRealizar procedimentos de gestão, planejamento, fiscalização e operação do trânsito.\nPromover a educação e a segurança do trânsito.\nOrganizar a operação do tráfego urbano.\nOrganizar o controle da manutenção de equipamentos de tráfego, o monitoramento do trânsito e das vias públicas, a fiscalização de trânsito e de veículos.\nSupervisionar o cumprimento da legislação referente ao trânsito de veículos.\nRealizar pesquisas e tratamentos estatísticos de tráfego.\nSupervisionar operações de tráfego.\nRealizar estudos e implantação de melhorias para o trânsito nas vias rurais, nas cidades e em regiões metropolitanas.\n\nPara atuação como Técnico em Trânsito, são fundamentais:\n\nConhecimentos e saberes relacionados aos processos de gestão, planejamento, projeto, implantação e operação de atividades relacionadas ao transporte de passageiros, à logística e ao transporte de cargas.\nConhecimentos e saberes relacionados à educação e à segurança no trânsito; à engenharia de tráfego, assegurando a mobilidade urbana de acordo com as técnicas e processos; e às normas técnicas.\nHabilidades e competências relacionadas à liderança de equipes, à solução de problemas técnicos e trabalhistas e à gestão de conflitos.",
  "pre_requisitos_ingresso": "Para ingresso no Curso Técnico Subsequente, o estudante deverá ter concluído o Ensino Médio.\nPara ingresso no Curso Técnico Concomitante, o estudante deverá estar cursando o Ensino Médio.\nPara ingresso no Curso Técnico Integrado ao Ensino Médio, o estudante deverá ter concluído o Ensino Fundamental.\nPara ingresso no Curso Técnico Integrado à Educação de Jovens e Adultos, o estudante deverá ter concluído o Ensino Fundamental.",
  "itinerarios_formativos": "Sugestões de qualificação profissional com certificações intermediárias, no curso técnico, considerando ocupações previstas na CBO:\n\nSupervisor de Transportes\n\nSugestões de formação continuada em cursos de especialização técnica (pós-técnico):\n\nEspecialização Técnica em Educação e Segurança para o Trânsito\nEspecialização Técnica em Geoprocessamento\nEspecialização Técnica em Legislação Urbanística e de Mobilidade Urbana\nEspecialização Técnica em Simulações\n\nSugestões de verticalização para cursos de graduação (Curso Superior de Tecnologia, Bacharelado e Licenciatura):\n\nCurso Superior de Tecnologia em Estradas\nCurso Superior de Tecnologia em Transporte Terrestre\nBacharelado em Engenharia Civil\nBacharelado em Engenharia de Transportes\nBacharelado em Engenharia de Mobilidade",
  "campo_atuacao": "Locais e ambientes de trabalho:\n\nAgências reguladoras públicas de transporte\nConcessionárias rodoviárias e ferroviárias\nEmpresas de consultorias de projetos\nEmpresas de engenharia de tráfego\nEmpresas de logística\nOperadoras de transporte público\nOperadoras de transporte de cargas\nÓrgãos gestores de mobilidade urbana\nCentros de formação de condutores\nEmpresas de operação e gestão de vias urbanas\nEmpresas de sinalização viária",
  "ocupacoes_cbo": "3423-05 - Chefe de Serviço de Transporte Rodoviário (passageiros e cargas)\n3423-05 - Assistente de Tráfego Rodoviário\n3423-05 - Chefe de Departamento de Motoristas\n3423-05 - Chefe de Serviço de Transporte Rodoviário\n3423-05 - Coordenador de Tráfego Rodoviário\n3423-05 - Encarregado de Tráfego Rodoviário\n3423-05 - Gerente de Frota (transporte rodoviário)\n3423-05 - Programador de Transporte Rodoviário\n3423-10 - Inspetor de Serviços de Transportes Rodoviários (passageiros e cargas)",
  "codigos_cbo": [
    "3423-05",
    "3423-10"
  ],
  "infraestrutura_minima": "Biblioteca com acervo físico ou virtual específico e atualizado\nLaboratório de informática com programas específicos\nLaboratório de simulação de trânsito\nLaboratório de segurança e educação para o trânsito\nLaboratório de desenho",
  "legislacao_profissional": "Lei nº 5.524, de 5 de novembro de 1968\nDecreto nº 90.922, de 6 de fevereiro de 1985\nResolução CFT nº 85, de 28 de outubro de 2019"
}
