{
  "id": "tecnico-em-estilismo-e-coordenacao-de-moda",
  "indice": 130,
  "denominacao": "Técnico em Estilismo e Coordenação de Moda",
  "denominacao_normalizada": "tecnico em estilismo e coordenacao de moda",
  "eixo_tecnologico": "Produção Cultural e Design",
  "area_tecnologica": "Design",
  "carga_horaria_minima_horas": 800,
  "descricao_carga_horaria_minima": "O curso dura, em média, 1 ano.\n\nO curso, na modalidade presencial, poderá prever até 20% da sua carga horária total em atividades não presenciais.\n\nO curso poderá ser realizado na modalidade EaD com, no mínimo, 20% de sua carga horária em atividades presenciais, nos termos das normas específicas definidas em cada sistema de ensino.\n\nA instituição, ofertante do curso, poderá desenvolver a carga horária em regime de alternância, com períodos de estudos na escola e outros períodos no campo de atuação/local de trabalho.\n\nAlém da carga horária mínima prevista, o curso poderá ter estágio curricular supervisionado obrigatório, a critério da instituição ofertante.\n\nCaso o curso seja ofertado na modalidade EaD, a carga horária de estágio deverá ser cumprida de forma presencial.",
  "perfil_profissional": "O Técnico em Estilismo e Coordenação de Moda será habilitado para:\n\nDesenvolver projetos de criação de coleções.\nTrabalhar na organização e produção comercial de produtos de moda.\nCriar, desenhar e acompanhar a execução de peças-piloto.\nCoordenar o desenvolvimento de coleções e de produtos, além de sua comercialização.\nCompor equipes de gerência de produtos e planejamento, além de negociar com fornecedores.\nPrestar serviço como autônomo, com negócio próprio ou como contratado por confecções e grandes lojas.\n\nPara atuação como Técnico em Estilismo e Coordenação de Moda, são fundamentais:\n\nConhecimentos interdisciplinares relacionados aos processos de criação, envolvendo pesquisa, idealização, planejamento, execução técnica, fruição e recepção estética.\nCompetências comunicacionais e empreendedoras voltadas à proposição de projetos, ao coletivo, à gestão, à solução de problemas e à resiliência, entre outras competências socioemocionais.",
  "pre_requisitos_ingresso": "Para ingresso no Curso Técnico Subsequente, o estudante deverá ter concluído o Ensino Médio.\nPara ingresso no Curso Técnico Concomitante, o estudante deverá estar cursando o Ensino Médio.\nPara ingresso no Curso Técnico Integrado ao Ensino Médio, o estudante deverá ter concluído o Ensino Fundamental.\nPara ingresso no Curso Técnico Integrado à Educação de Jovens e Adultos, o estudante deverá ter concluído o Ensino Fundamental.",
  "itinerarios_formativos": "Sugestões de qualificação profissional com certificações intermediárias, no curso técnico, considerando ocupações previstas na CBO:\n\nAssistente em Criação de Moda\nAssistente de Desenvolvimento de Criação de Moda\nAssistente em Gestão de Produto de Moda\n\nSugestões de formação continuada em cursos de especialização técnica (pós-técnico):\n\nEspecialização Técnica em Modelagem\nEspecialização Técnica em Desenho de Moda\n\nSugestões de verticalização para cursos de graduação (Curso Superior de Tecnologia, Bacharelado e Licenciatura):\n\nCurso Superior de Tecnologia em Design de Moda\nBacharelado em Moda",
  "campo_atuacao": "Locais e ambientes de trabalho:\n\nPrestar Serviço como Autônomo, em Ateliê Próprio\nConfecções e Grandes Lojas",
  "ocupacoes_cbo": "Ocupação ainda não classificada",
  "codigos_cbo": [],
  "infraestrutura_minima": "Biblioteca com acervo físico ou virtual específico e atualizado\nLaboratório de informática com programas específicos\nAteliê de desenho\nLaboratório de modelagem\nSala multimídia",
  "legislacao_profissional": "Profissão não regulamentada."
}
