{
  "id": "tecnico-em-nutricao-e-dietetica",
  "indice": 16,
  "denominacao": "Técnico em Nutrição e Dietética",
  "denominacao_normalizada": "tecnico em nutricao e dietetica",
  "eixo_tecnologico": "Ambiente e Saúde",
  "area_tecnologica": "Gestão e Promoção da Saúde e Bem-Estar",
  "carga_horaria_minima_horas": 1200,
  "descricao_carga_horaria_minima": "O curso dura, em média, 1 ano e meio.\n\nO curso, na modalidade presencial, poderá prever até 20% da sua carga horária total em atividades não presenciais.\n\nO curso poderá ser realizado na modalidade EaD com, no mínimo, 50% da carga horária em atividades presenciais, nos termos das normas específicas definidas em cada sistema de ensino.\n\nA instituição, ofertante do curso, poderá desenvolver a carga horária em regime de alternância, com períodos de estudos na escola e outros períodos no campo/local de trabalho.\n\nAlém da carga horária mínima prevista, o curso poderá ter estágio curricular supervisionado obrigatório, a critério da instituição ofertante.\n\nCaso o curso seja ofertado na modalidade EaD, a carga horária de estágio deverá ser cumprida de forma presencial.",
  "perfil_profissional": "O Técnico em Nutrição e Dietética será habilitado para:\n\nDesenvolver, sob a supervisão de profissionais de nível superior, atividades relacionadas à educação alimentar e nutricional de indivíduos e comunidades, para prevenção e controle de carências nutricionais, de doenças crônicas não transmissíveis e de doenças veiculadas por alimentos.\nRealizar coleta de dados de interesse ao Serviço de Nutrição e Dietética, bem como dados antropométricos para subsidiar a avaliação nutricional a ser realizada pelo nutricionista.\nRealizar estudos das necessidades nutricionais de indivíduos e coletividades, em todas as fases do ciclo vital.\nMonitorar dietas de rotina sobre prescrição dietética.\nAcompanhar e orientar a execução das atividades que compõe toda a escala de produção de refeições, bem como as atividades de controle de qualidade higiênico-sanitárias, atendendo às normas de Segurança Alimentar e Nutricional.\nAuxiliar no planejamento e na execução dos procedimentos de rotina, bem como orientar e monitorar as atividades realizadas pela equipe de funcionários.\nAplicar normas de segurança do trabalho na produção de refeições e no comércio de alimentos.\nContribuir na elaboração de cardápios e na elaboração de relatórios técnicos de não conformidades.\nTrabalhar também na pesquisa e no desenvolvimento de novos produtos alimentícios.\nAtuar em diferentes segmentos, sob orientação e supervisão do nutricionista.\n\nPara a atuação como Técnico em Nutrição e Dietética, são fundamentais:\n\nConhecimentos das políticas públicas de saúde e compreensão de sua atuação profissional frente às diretrizes, princípios e estrutura organizacional do Sistema Único de Saúde (SUS).\nConhecimentos e saberes relacionados aos princípios das técnicas aplicadas na área, sempre pautados numa postura humana e ética.\nResolução de situações-problema, comunicação, trabalho em equipe e interdisciplinar, tecnologias da informação e da comunicação, gestão de conflitos e ética profissional.\nOrganização e responsabilidade.\nIniciativa social.\nDeterminação e criatividade, buscando promover a humanização da assistência.\nAtualização e aperfeiçoamento profissional por meio da Educação Continuada.",
  "pre_requisitos_ingresso": "Para ingresso no Curso Técnico Subsequente, o estudante deverá ter concluído o Ensino Médio.\nPara ingresso no Curso Técnico Concomitante, o estudante deverá estar cursando o Ensino Médio.\nPara ingresso no Curso Técnico Integrado ao Ensino Médio, o estudante deverá ter concluído o Ensino Fundamental.\nPara ingresso no Curso Técnico Integrado à Educação de Jovens e Adultos, o estudante deverá ter concluído o Ensino Fundamental.",
  "itinerarios_formativos": "Sugestões de qualificação profissional com certificações intermediárias, no curso técnico, considerando ocupações previstas na CBO:\n\nCopeiro Hospitalar\nLactarista\n\nSugestões de formação continuada em cursos de especialização técnica (pós-técnico):\n\nEspecialização Técnica em Alimentação Escolar\nEspecialização Técnica em Cadeia de Produção de Alimentos\nEspecialização Técnica em Gastronomia Hospitalar\nEspecialização Técnica em Segurança Alimentar e Nutricional\nEspecialização Técnica em Terapia Renal Substitutiva\nNutrição para Educação Física\n\nSugestões de verticalização para cursos de graduação (Curso Superior de Tecnologia, bacharelado e licenciatura):\n\nCurso Superior de Tecnologia em Alimentos\nCurso Superior de Tecnologia em Gastronomia\nCurso Superior de Tecnologia em Laticínios\nBacharelado em Engenharia de Alimentos\nBacharelado em Nutrição",
  "campo_atuacao": "Locais e ambientes de trabalho:\n\nIndústria de Alimentos e da Cozinha\nUnidades de Alimentação e Nutrição (UAN)\nComércio Varejista de Alimentos\nClínicas\nHospitais\nInstituições de Longa Permanência e Similares\nProgramas Institucionais Públicos e Privados de Saúde Coletiva",
  "ocupacoes_cbo": "3252-10 - Técnico em Nutrição",
  "codigos_cbo": [
    "3252-10"
  ],
  "infraestrutura_minima": "Biblioteca com acervo físico ou virtual específico e atualizado\nLaboratório de anatomia e antropometria\nLaboratório de informática com programas específicos ao curso e acesso à internet\nLaboratório multifuncional de técnica dietética",
  "legislacao_profissional": "Resolução CFN nº 543, de 4 de agosto de 2014\nResolução CFN nº 604, de 22 de abril de 2018\nResolução CFN nº 605, de 22 de abril de 2018"
}
