{
  "id": "tecnico-em-teatro",
  "indice": 147,
  "denominacao": "Técnico em Teatro",
  "denominacao_normalizada": "tecnico em teatro",
  "eixo_tecnologico": "Produção Cultural e Design",
  "area_tecnologica": "Manifestações Artísticas",
  "carga_horaria_minima_horas": 1000,
  "descricao_carga_horaria_minima": "O curso dura, em média, 1 ano.\n\nO curso, na modalidade presencial, poderá prever até 20% da sua carga horária total em atividades não presenciais.\n\nO curso poderá ser realizado na modalidade EaD com, no mínimo, 20% de sua carga horária em atividades presenciais, nos termos das normas específicas definidas em cada sistema de ensino.\n\nA instituição, ofertante do curso, poderá desenvolver a carga horária em regime de alternância, com períodos de estudos na escola e outros períodos no campo de atuação/local de trabalho.\n\nAlém da carga horária mínima prevista, o curso poderá ter estágio curricular supervisionado obrigatório, a critério da instituição ofertante.\n\nCaso o curso seja ofertado na modalidade EaD, a carga horária de estágio deverá ser cumprida de forma presencial.",
  "perfil_profissional": "O Técnico em Teatro será habilitado para:\n\nEstudar e investigar práticas e métodos do processo de criação teatral na contemporaneidade, sem perder de vista as perspectivas históricas, sociais e culturais das artes cênicas locais e mundiais.\nAtuar profissionalmente e de maneira interdisciplinar no campo das artes do palco ? cenografia e figurinos, dramaturgia, direção teatral, iluminação, sonoplastia e técnicas de palco (cenotécnica).\nAtuar abrangendo perspectivas desde o drama ao humor, do teatro infanto-juvenil ao adulto, do teatro brasileiro ao internacional.\nCriar cenas, situações, personagens e figuras, com os procedimentos técnicos, estéticos e éticos que envolvem o trabalho do atuante no teatro e no audiovisual.\nAtuar em diferentes modos da produção em artes cênicas, tais como teatros de grupo, solos, performances e musical.\nReconhecer os diversos campos da representação artística e da perfomatividade, considerando as práticas performativas identitárias, as diversidades culturais e artísticas brasileiras: ameríndias, africanas e europeias.\nCriar e produzir pensamento crítico sobre as relações do artista com o público, dentro da esfera das produções destinadas aos espectadores infantis, juvenis e adultos.\nConhecer os mecanismos que envolvem o desenvolvimento artístico e cultural nas produções das artes cênicas na contemporaneidade.\n\nPara atuação como Técnico em Teatro, são fundamentais:\n\nConhecimentos interdisciplinares relacionados aos processos de criação, envolvendo pesquisa, idealização, planejamento, execução técnica, fruição e recepção estética.\nCompetências comunicativas e empreendedoras voltadas à proposição de projetos, ao coletivo, à gestão, à solução de problemas e à resiliência, entre outras competências socioemocionais.",
  "pre_requisitos_ingresso": "Para ingresso no Curso Técnico Subsequente, o estudante deverá ter concluído o Ensino Médio.\nPara ingresso no Curso Técnico Concomitante, o estudante deverá estar cursando o Ensino Médio.\nPara ingresso no Curso Técnico Integrado ao Ensino Médio, o estudante deverá ter concluído o Ensino Fundamental.\nPara ingresso no Curso Técnico Integrado à Educação de Jovens e Adultos, o estudante deverá ter concluído o Ensino Fundamental.",
  "itinerarios_formativos": "Sugestões de qualificação profissional com certificações intermediárias, no curso técnico, considerando ocupações previstas na CBO:\n\nAtor\nAutor-roteirista (Dramaturgo)\nDiretor de Espetáculos e Afins\nCenógrafo\nCenotécnico\nCamareiro\nMaquinista\nSonoplasta\nIluminador\n\nSugestões de formação continuada em cursos de especialização técnica (pós-técnico):\n\nEspecialização Técnica em Direção\nEspecialização Técnica em Dramaturgia\nEspecialização Técnica em Humor\nEspecialização Técnica em Iluminação\nEspecialização Técnica em Sonoplastia\nEspecialização Técnica em Técnicas de Palco\n\nSugestões de verticalização para cursos de graduação (Curso Superior de Tecnologia, Bacharelado e Licenciatura):\n\nCurso Superior de Tecnologia em Produção Cultural\nCurso Superior de Tecnologia em Produção Cênica\nBacharelado em Teatro\nBacharelado em Cinema e Audiovisual\nLicenciatura em Teatro",
  "campo_atuacao": "Locais e ambientes de trabalho:\n\nTeatros e Espaços Alternativos para Apresentação de Espetáculos\nGrupos e Companhias de Teatro\nColetivos de Pesquisa em Artes Cênicas\nEmpresas de Vídeo, Radiodifusão, Cinema e TV\nInstituições Públicas e Privadas de Difusão Cultural e Artística\nEmpresas de Eventos e Recreação\nProjetos Socioculturais",
  "ocupacoes_cbo": "3742-05 - Cenotécnico (cinema, vídeo, televisão, teatro e espetáculos)\n3742-05 - Construtor de Cenários\n3742-10 - Maquinista de Cinema e Vídeo\n3742-15 - Maquinista de Teatro e Espetáculos",
  "codigos_cbo": [
    "3742-05",
    "3742-10",
    "3742-15"
  ],
  "infraestrutura_minima": "Biblioteca com acervo físico ou virtual específico e atualizado\nLaboratório de informática com programas específicos\nSalas multimídia de práticas artísticas e estudos teóricos\nOficina de cenografia\nOficina de figurinos",
  "legislacao_profissional": "Lei nº 6.533, de 24 de maio de 1978\nDecreto nº 82.385, de 5 de outubro de 1978"
}
