{
  "id": "tecnico-em-contabilidade",
  "indice": 85,
  "denominacao": "Técnico em Contabilidade",
  "denominacao_normalizada": "tecnico em contabilidade",
  "eixo_tecnologico": "Gestão e Negócios",
  "area_tecnologica": "Operações Financeiras",
  "carga_horaria_minima_horas": 800,
  "descricao_carga_horaria_minima": "O curso dura, em média, 1 ano.\n\nO curso ofertado, na modalidade presencial, poderá prever até 20% da sua carga horária total em atividades não presenciais.\n\nO curso poderá ser realizado na modalidade EaD com, no mínimo, 20% da carga horária em atividades presenciais, nos termos das normas específicas definidas em cada sistema de ensino.\n\nA instituição, ofertante do curso, poderá desenvolver a carga horária em regime de alternância, com períodos de estudos na escola e outros períodos no campo/local de trabalho.\n\nAlém da carga horária mínima prevista, o curso poderá ter estágio curricular supervisionado obrigatório, a critério da instituição ofertante.\n\nCaso o curso seja ofertado na modalidade EaD, a carga horária de estágio deverá ser cumprida de forma presencial.",
  "perfil_profissional": "O Técnico em Contabilidade será habilitado para:\n\nExecutar processos administrativos e contábeis.\nClassificar documentos contábeis, fiscais e não fiscais.\nCalcular tributos federais, estaduais e municipais.\nPrestar atendimento à fiscalização e apresentar documentos, livros e relatórios contábeis.\nElaborar planos de determinação das taxas de depreciação e exaustão dos bens materiais e de amortização dos valores imateriais.\nOrdenar os fatos contábeis por débito e crédito.\nApurar haveres, direitos e obrigações legais.\n\nPara atuação como Técnico em Contabilidade, são fundamentais:\n\nConhecimentos e saberes relacionados aos processos financeiros e contábeis empresariais, de modo a atuar em conformidade com as legislações e diretrizes de órgãos reguladores, como também com as normas de saúde e segurança do trabalho, sempre sob a supervisão de um contabilista.\nAtuação pautada em decisões responsáveis baseadas em conceitos éticos construtivos e relacionamentos positivos, trabalho em equipe e resolução efetiva de conflitos.",
  "pre_requisitos_ingresso": "Para ingresso no Curso Técnico Subsequente, o estudante deverá ter concluído o Ensino Médio.\nPara ingresso no Curso Técnico Concomitante, o estudante deverá estar cursando o Ensino Médio.\nPara ingresso no Curso Técnico Integrado ao Ensino Médio, o estudante deverá ter concluído o Ensino Fundamental.\nPara ingresso no Curso Técnico Integrado à Educação de Jovens e Adultos, o estudante deverá ter concluído o Ensino Fundamental.",
  "itinerarios_formativos": "Sugestões de qualificação profissional com certificações intermediárias, no curso técnico, considerando ocupações previstas na CBO:\n\nAuxiliar de Contabilidade\nAuxiliar de Faturamento\nAuxiliar de Tesouraria\nAuxiliar Financeiro\n\nSugestões de formação continuada em cursos de especialização técnica em (pós-técnica):\n\nEspecialização Técnica em Finanças e Legislação Tributária\n\nSugestões de verticalização para cursos de graduação (Curso Superior de Tecnologia, bacharelado e licenciatura):\n\nCurso Superior de Tecnologia em Gestão Financeira\nBacharelado em Ciências Contábeis",
  "campo_atuacao": "Locais e ambientes de trabalho:\n\nEmpresas de Prestação de Serviços\nEmpresas de Consultorias e/ou de Auditorias",
  "ocupacoes_cbo": "3511-05 - Técnico de Contabilidade\n3511-10 - Chefe de Contabilidade (Técnico)\n3511-15 - Consultor Contábil (Técnico)",
  "codigos_cbo": [
    "3511-05",
    "3511-10",
    "3511-15"
  ],
  "infraestrutura_minima": "Biblioteca com acervo físico ou virtual específico e atualizado\nLaboratório de informática com programas específicos",
  "legislacao_profissional": "Profissão não regulamentada."
}
