{
  "id": "tecnico-em-cervejaria",
  "indice": 113,
  "denominacao": "Técnico em Cervejaria",
  "denominacao_normalizada": "tecnico em cervejaria",
  "eixo_tecnologico": "Produção Alimentícia",
  "area_tecnologica": "Este Eixo Tecnológico não possui divisão em Áreas Tecnológicas.",
  "carga_horaria_minima_horas": 1200,
  "descricao_carga_horaria_minima": "O curso dura, em média, 1 ano e meio.\n\nO curso ofertado, na modalidade presencial, poderá prever até 20% da sua carga horária total em atividades não presenciais.\n\nO curso poderá ser realizado na modalidade EaD com, no mínimo, 20% da carga horária em atividades presenciais, nos termos das normas específicas definidas em cada sistema de ensino.\n\nA instituição, ofertante do curso, poderá desenvolver a carga horária em regime de alternância, com períodos de estudos na escola e outros períodos no campo/local de trabalho.\n\nAlém da carga horária mínima prevista, o curso poderá ter estágio curricular supervisionado obrigatório, a critério da instituição ofertante.\n\nCaso o curso seja ofertado na modalidade EaD, a carga horária de estágio deverá ser cumprida de forma presencial.",
  "perfil_profissional": "O Técnico em Cervejaria será habilitado para:\n\nCoordenar e supervisionar atividades de fabricação de cervejas.\nDesenvolver técnicas mercadológicas de produtos e insumos para a indústria cervejeira.\nCoordenar a aquisição e a manutenção de equipamentos e insumos.\nPromover a inovação tecnológica e o desenvolvimento de novos produtos.\nControlar e corrigir desvios nos processos manuais e automatizados.\nUtilizar boas práticas de fabricação, de rotulagem e de identificação de embalagens adequadas.\nEfetuar o controle de qualidade.\nRealizar análises químicas, físicas, biológicas e sensoriais.\nPlanejar e executar o processo de trabalho, de comércio e de venda de cervejas.\nSupervisionar o tratamento e o destino adequado de resíduos e efluentes.\nOperar software para controle do processo cervejeiro.\n\nPara atuação como Técnico em Cervejaria, são fundamentais:\n\nConhecimentos e saberes relacionados aos processos manuais e automatizados de produção de cerveja e à operacionalização de software para controle do processo.\nConhecimentos e saberes relacionados à gestão de resíduos da indústria cervejeira, à gestão na indústria cervejeira, ao empreendedorismo e à inovação.\nConhecimentos e saberes relacionados às normas técnicas de qualidade da indústria cervejeira e da cerveja.\nConhecimentos e saberes relacionados à execução de análises de qualidade da cerveja.\nConhecimentos e saberes relacionados à solução de problemas, à criatividade e ao trabalho em equipe.",
  "pre_requisitos_ingresso": "Para ingresso no Curso Técnico Subsequente, o estudante deverá ter concluído o Ensino Médio.\nPara ingresso no Curso Técnico Concomitante, o estudante deverá estar cursando o Ensino Médio.\nPara ingresso no Curso Técnico Integrado ao Ensino Médio, o estudante deverá ter concluído o Ensino Fundamental.\nPara ingresso no Curso Técnico Integrado à Educação de Jovens e Adultos, o estudante deverá ter concluído o Ensino Fundamental.",
  "itinerarios_formativos": "Sugestões de qualificação profissional com certificações intermediárias, no curso técnico, considerando ocupações previstas na CBO:\n\nCervejeiro\nProdutor de Cervejas\nSommelier de Cervejas\n\nSugestões de formação continuada em cursos de especialização técnica (pós-técnico):\n\nEspecialização Técnica em Mestre Cervejeiro\nEspecialização Técnica em Brassagem\n\nSugestões de verticalização para cursos de graduação (Curso Superior de Tecnologia, Bacharelado e Licenciatura):\n\nCurso Superior de Tecnologia em Alimentos\nCurso Superior de Tecnologia em Agroindústria\nCurso Superior de Tecnologia em Produção de Cachaça\nCurso Superior de Tecnologia em Viticultura e Enologia\nBacharelado em Engenharia de Alimentos\nBacharelado em Ciência e Tecnologia de Alimentos",
  "campo_atuacao": "Locais e ambientes de trabalho:\n\nIndústrias de fabricação de cervejas e microcervejarias\nAgroindústrias e indústrias de bebidas\nServiços de distribuição e comercialização\nInstituições de ensino e/ou pesquisa\nConsultorias técnicas\nAutônomo\nEmpreendimento próprio\nEmpresa de insumos e de equipamentos para produção de cerveja",
  "ocupacoes_cbo": "8417-10 - Cervejeiro",
  "codigos_cbo": [
    "8417-10"
  ],
  "infraestrutura_minima": "Biblioteca com acervo físico ou virtual específico e atualizado\nLabotarório de informática com programas específicos\nPlanta piloto de processamento de cerveja\nLaboratórios de análises microbiológicas, físico-químicas e sensoriais",
  "legislacao_profissional": "Lei nº 5.524, de 5 de novembro de 1968\nDecreto nº 90.922, de 6 de fevereiro de 1985\nDecreto nº 4.560, de 30 de dezembro de 2002\nResolução CFT nº 85, de 28 de outubro de 2019"
}
